{
  "active_benchmark_id": "golden-benchmark-v1",
  "active_frontier": [
    "RN-0003"
  ],
  "benchmarks": [
    {
      "benchmark_id": "golden-benchmark-v1",
      "benchmark_ref": "BENCHMARK.md",
      "display_metrics": [
        {
          "direction": "MAXIMIZE",
          "label": "AUC",
          "metric_id": "auc",
          "precision": 4,
          "role": "PRIMARY",
          "unit": "RATIO"
        }
      ]
    }
  ],
  "created_at": "2026-07-19T12:00:00Z",
  "edges": [
    {
      "edge_type": "PRIMARY_PARENT",
      "evidence_ref": null,
      "from_node_id": "RN-0001",
      "reason": null,
      "to_node_id": "RN-0002"
    },
    {
      "edge_type": "DIRECTION",
      "evidence_ref": "evidence/weighting-mechanism.md",
      "from_node_id": "LN-0001",
      "reason": "Selected by the synthetic golden-run literature fixture.",
      "to_node_id": "RN-0002"
    },
    {
      "edge_type": "PRIMARY_PARENT",
      "evidence_ref": null,
      "from_node_id": "RN-0002",
      "reason": null,
      "to_node_id": "RN-0003"
    },
    {
      "edge_type": "DIRECTION",
      "evidence_ref": "evidence/loss-mechanism.md",
      "from_node_id": "LN-0001",
      "reason": "Selected by the synthetic golden-run literature fixture.",
      "to_node_id": "RN-0003"
    }
  ],
  "nodes": [
    {
      "benchmark_id": "golden-benchmark-v1",
      "branch_reason": null,
      "branch_status": "OPEN",
      "candidate_priority": null,
      "classification": null,
      "comparison_target_id": "RN-0001",
      "created_at": "2026-07-19T12:00:00Z",
      "experiment_id": null,
      "falsification_condition": null,
      "hypothesis": null,
      "hypothesis_verdict": "NOT_EVALUABLE",
      "mechanism": null,
      "metric_summary": [
        {
          "delta_vs_champion": 0.0,
          "delta_vs_research_base": 0.0,
          "label": "AUC",
          "metric_id": "auc",
          "value": 0.8
        }
      ],
      "node_id": "RN-0001",
      "node_type": "RESEARCH",
      "priority_reason": null,
      "refs": {
        "experiment_card": null,
        "interaction_review_pack": null,
        "paper_mechanism_cards": [],
        "research_log": null,
        "run_directory": null
      },
      "release_condition": null,
      "research_base_id": "RN-0001",
      "run_outcome": "COMPLETED",
      "single_main_change": null,
      "title": "Stable small MLP"
    },
    {
      "created_at": "2026-07-19T12:00:00Z",
      "direction_summary": "First replace data weighting; if supported, pivot to a loss-only replacement while retaining the promoted base.",
      "literature_survey_ref": "logs/research/literature_survey.md",
      "node_id": "LN-0001",
      "node_type": "LITERATURE",
      "outcome_reason": "Three synthetic fixtures demonstrate two testable example directions.",
      "research_question": "Which component replacements can improve AUC without changing the frozen benchmark?",
      "search_outcome": "DIRECTIONS_FOUND",
      "search_scope": "Synthetic component-mechanism fixtures for tabular classifiers.",
      "selected_papers": [
        {
          "mechanism_card_ref": "evidence/paper-1-mechanism.md",
          "pdf_ref": "papers/paper-1.pdf",
          "title": "Frequency-Aware Learning"
        },
        {
          "mechanism_card_ref": "evidence/paper-2-mechanism.md",
          "pdf_ref": "papers/paper-2.pdf",
          "title": "Robust Tabular Calibration"
        },
        {
          "mechanism_card_ref": "evidence/paper-3-mechanism.md",
          "pdf_ref": "papers/paper-3.pdf",
          "title": "Mechanism-Guided Ablation"
        }
      ],
      "title": "Component-level directions for tabular AUC",
      "trigger": {
        "reason": "Bootstrap literature research after freezing the benchmark.",
        "source_node_ids": [],
        "source_ref": null,
        "type": "BOOTSTRAP"
      }
    },
    {
      "benchmark_id": "golden-benchmark-v1",
      "branch_reason": null,
      "branch_status": "OPEN",
      "candidate_priority": "GOLD",
      "classification": {
        "change_operator": "REPLACE",
        "change_scope": "COMPONENT",
        "evidence_class": "N",
        "intervention_locus": "DATA",
        "research_layer": "L1"
      },
      "comparison_target_id": "RN-0001",
      "created_at": "2026-07-19T12:00:00Z",
      "experiment_id": "E001",
      "falsification_condition": "AUC improvement is no greater than 0.5 pp.",
      "hypothesis": "Frequency-aware weighting improves AUC by more than 0.5 pp.",
      "hypothesis_verdict": "SUPPORTED",
      "mechanism": "The replacement reduces majority-example gradient dominance.",
      "metric_summary": [
        {
          "delta_vs_champion": 0.01200000000000001,
          "delta_vs_research_base": 0.01200000000000001,
          "label": "AUC",
          "metric_id": "auc",
          "value": 0.812
        }
      ],
      "node_id": "RN-0002",
      "node_type": "RESEARCH",
      "priority_reason": "One component replacement with a falsifiable mediator prediction.",
      "refs": {
        "experiment_card": "experiments/E001.md",
        "interaction_review_pack": null,
        "paper_mechanism_cards": [
          "evidence/weighting-mechanism.md"
        ],
        "research_log": "logs/research/volume_001.md",
        "run_directory": "logs/runs/E001/"
      },
      "release_condition": null,
      "research_base_id": "RN-0001",
      "run_outcome": "NORMAL_EARLY_STOP",
      "single_main_change": "Replace only the example-weighting component.",
      "title": "Frequency-aware weighting replacement"
    },
    {
      "benchmark_id": "golden-benchmark-v1",
      "branch_reason": null,
      "branch_status": "OPEN",
      "candidate_priority": "GOLD",
      "classification": {
        "change_operator": "REPLACE",
        "change_scope": "COMPONENT",
        "evidence_class": "N",
        "intervention_locus": "LOSS",
        "research_layer": "L2"
      },
      "comparison_target_id": "RN-0002",
      "created_at": "2026-07-19T12:00:00Z",
      "experiment_id": null,
      "falsification_condition": "AUC does not improve or calibration error moves oppositely.",
      "hypothesis": "Replacing only calibration loss improves AUC.",
      "hypothesis_verdict": "UNTESTED",
      "mechanism": "A margin-calibrated loss improves ranking without changing the promoted weighting component.",
      "metric_summary": [
        {
          "delta_vs_champion": null,
          "delta_vs_research_base": null,
          "label": "AUC",
          "metric_id": "auc",
          "value": null
        }
      ],
      "node_id": "RN-0003",
      "node_type": "RESEARCH",
      "priority_reason": "One component replacement with a falsifiable mediator prediction.",
      "refs": {
        "experiment_card": null,
        "interaction_review_pack": null,
        "paper_mechanism_cards": [
          "evidence/loss-mechanism.md"
        ],
        "research_log": null,
        "run_directory": null
      },
      "release_condition": null,
      "research_base_id": "RN-0002",
      "run_outcome": "NOT_RUN",
      "single_main_change": "Replace only calibration loss.",
      "title": "Calibration-loss replacement"
    }
  ],
  "project_id": "golden-tabular-auc",
  "revision": 10,
  "role_events": [
    {
      "benchmark_id": "golden-benchmark-v1",
      "created_at": "2026-07-19T12:00:00Z",
      "event_type": "ASSIGNED",
      "evidence_ref": "BENCHMARK.md",
      "node_id": "RN-0001",
      "reason": "Initial frozen role",
      "role": "ANCHOR_BASELINE"
    },
    {
      "benchmark_id": "golden-benchmark-v1",
      "created_at": "2026-07-19T12:00:00Z",
      "event_type": "ASSIGNED",
      "evidence_ref": "BENCHMARK.md",
      "node_id": "RN-0001",
      "reason": "Initial frozen role",
      "role": "RESEARCH_BASE"
    },
    {
      "benchmark_id": "golden-benchmark-v1",
      "created_at": "2026-07-19T12:00:00Z",
      "event_type": "ASSIGNED",
      "evidence_ref": "BENCHMARK.md",
      "node_id": "RN-0001",
      "reason": "Initial frozen role",
      "role": "CHAMPION"
    },
    {
      "benchmark_id": "golden-benchmark-v1",
      "created_at": "2026-07-19T12:00:00Z",
      "event_type": "REPLACED",
      "evidence_ref": "experiments/E001.md",
      "node_id": "RN-0002",
      "previous_node_id": "RN-0001",
      "reason": "Reconciled the best valid primary metric after result writeback",
      "role": "CHAMPION"
    },
    {
      "benchmark_id": "golden-benchmark-v1",
      "created_at": "2026-07-19T12:00:00Z",
      "event_type": "REPLACED",
      "evidence_ref": "experiments/E001.md",
      "node_id": "RN-0002",
      "previous_node_id": "RN-0001",
      "reason": "The justified full run passed the frozen performance and structural gates.",
      "role": "RESEARCH_BASE",
      "single_seed_provisional": true
    }
  ],
  "role_states": {
    "golden-benchmark-v1": {
      "anchor_baseline_id": "RN-0001",
      "champion_id": "RN-0002",
      "reference_baseline_ids": [],
      "research_base_id": "RN-0002",
      "simplification_anchor_id": "RN-0002"
    }
  },
  "schema_version": "1.0",
  "stage_summaries": [
    {
      "covered_node_ids": [
        "RN-0001",
        "RN-0002"
      ],
      "created_at": "2026-07-19T12:00:00Z",
      "route_decision": "PIVOT",
      "summary_id": "SS-001",
      "summary_ref": "logs/summaries/volume_001_summary.md",
      "trigger": "First supported formal experiment completed."
    }
  ],
  "updated_at": "2026-07-19T12:00:00Z"
}
